{
  "version": "providers.v1",
  "selected": {
    "candidate": {
      "source": {
        "id": "synthetic-source-1",
        "provider": "vidcore",
        "title": {
          "type": "movie",
          "tmdb_id": 27205,
          "imdb_id": "tt1375666"
        },
        "content_verified": false,
        "url": "https://media.example.com/movie.mp4",
        "format": "mp4",
        "fetch_context": {},
        "resolver_metadata": {
          "provider_data": {
            "unknown": {
              "preserve": true,
              "big": 18446744073709551617,
              "decimal": 0.12345678901234567890123456789
            }
          },
          "tracks_known": false
        }
      },
      "observation": {
        "at": "2030-01-01T00:00:00Z",
        "accessible": true,
        "format": "mp4",
        "playlist_metadata": {
          "tracks_known": false
        },
        "samples_completed": 3,
        "sample_bytes": 393216,
        "encrypted": false,
        "protection_known": true
      }
    },
    "score": 40,
    "reasons": null
  },
  "backups": null,
  "rejected": null,
  "providers": [
    {
      "provider": "vidcore",
      "duration": 1000000000,
      "candidate_count": 1
    }
  ]
}
